{
  "id": "99999999-9999-4999-8999-999999999999",
  "user_id": "22222222-2222-4222-8222-222222222222",
  "activity_id": "aaaaaaaa-aaaa-4aaa-8aaa-aaaaaaaaaaaa",
  "session_id": "33333333-3333-4333-8333-333333333333",
  "snapshot_id": "11111111-1111-4111-8111-111111111111",
  "feature_schema_version": "1.3.0",
  "feature_family": "duration_prediction",
  "features": {
    "activity_sample_count": 12,
    "hour_bucket": "morning",
    "day_type": "weekend",
    "place_category": "kitchen",
    "work_mode": "home",
    "motion_state": "stationary",
    "capture_method": "voice",
    "prior_interruption_count": 1,
    "context_quality_score": 0.82
  },
  "source_entity_refs": [
    {
      "type": "timing_session",
      "id": "33333333-3333-4333-8333-333333333333"
    },
    {
      "type": "capture_context_snapshot",
      "id": "11111111-1111-4111-8111-111111111111"
    }
  ],
  "privacy_class": "normal",
  "model_eligible": true,
  "exclusion_reason": null,
  "generated_at": "2026-04-26T14:20:00Z"
}
